{"schema_version":"0.1","heartbeat_id":"hb_01J000000000000000000001","agent_id":"agt_01J000000000000000000001","property_id":"prp_01J000000000000000000001","sequence":42,"session_id":"ses_01J000000000000000000001","sent_at":"2026-07-14T12:00:00+00:00","agent_uptime_seconds":3600,"mode":"normal","gateway":{"state":"up","latency_ms":4},"internet":{"state":"up","dns_state":"up","https_ok":3},"critical":{"healthy":2,"degraded":0,"offline":0,"unknown":0},"last_event_sequence":41,"queued_events":0,"agent_version":"0.1.0-test"}
